<?xml version="1.0" encoding="UTF-8"?>
<!--Sample XML file generated by XMLSpy v2011 rel. 2 (http://www.altova.com)-->
<BackupData Name="String" xsi:noNamespaceSchemaLocation="file:///D:/E/Projects/CSharp/BackBock/Jedzia.BackBock.Model/Data/BackupData.xsd" xmlns:xsi="http://www.w3.org/2001/XMLSchema-instance">
	<BackupItem IsEnabled="false" Name="Firefox" Test="text"/>
	<BackupItem IsInterface="true" Name="Meine Texte" IsEnabled="true" Test="text"/>
	<BackupItem IsInterface="true" Name="D:\ misc" IsEnabled="true" Test="text"/>
	<BackupItem IsInterface="true" Name="String" IsEnabled="true" Test="text"/>
	<BackupItem IsInterface="true" Name="String" IsEnabled="true" Test="text"/>
	<BackupItem IsInterface="true" Name="Blabllaah" IsEnabled="false" Test="text"/>
	<BackupItem IsInterface="true" Name="Music" IsEnabled="true" Test="text"/>
	<BackupItem IsInterface="true" Name="Thunderbird Data" IsEnabled="true" Test="text"/>
	<BackupItem IsInterface="true" Name="Password-Safe" IsEnabled="true" Test="text"/>
</BackupData>
